{
  "schema_version": 1,
  "id": "sector-growth",
  "display_name": "Sector Growth",
  "tagline": "Consulting hours for Sector Growth",
  "website": "https://sectorgrowth.com",
  "currency": "CAD",
  "currency_symbol": "$",
  "currency_display_suffix": "CAD",
  "data_repo_prefix": "hours-data-sector-growth-",
  "theme": {
    "mode": "light",
    "bg_deep": "#0A1628",
    "bg_darker": "#050B16",
    "accent_cyan": "#6BCFEE",
    "accent_mid": "#2A85C4",
    "accent_deep": "#1E4DA8",
    "text_primary": "#0f172a",
    "text_muted": "#475569",
    "border_subtle": "rgba(0,0,0,0.06)",
    "border_strong": "rgba(0,0,0,0.12)"
  },
  "fonts": {
    "display": "system-ui, -apple-system, 'Segoe UI', Roboto, sans-serif",
    "body": "system-ui, -apple-system, 'Segoe UI', Roboto, sans-serif",
    "mono": "'SF Mono', 'Cascadia Code', 'Fira Code', ui-monospace, monospace"
  },
  "assets": {
    "logo": "logo.webp",
    "logo_alt_text": "Sector Growth",
    "logo_width": 180,
    "logo_height": 48,
    "logo_dark_filter": "invert(1) hue-rotate(180deg) brightness(1.05)",
    "favicon": "favicon.png"
  },
  "enabled": true
}
